{"$schema":"https://json-schema.org/draft/2020-12/schema","title":"ArchQED task","type":"object","required":["id","title","status","source_refs","dependencies","acceptance","forbidden"],"properties":{"id":{"type":"string"},"title":{"type":"string"},"status":{"type":"string"},"source_refs":{"type":"array"},"dependencies":{"type":"array"},"acceptance":{"type":"array"},"forbidden":{"type":"array"}}}
